{
  "id": "kneez_assessment_v2",
  "version": "2.0.0",
  "title": "Kneez Initial Assessment (v2 beta)",
  "entry_node_id": "q_knee_region",
  "nodes": {
    "q_knee_region": {
      "id": "q_knee_region",
      "type": "question",
      "label": "Primary knee region",
      "prompt": "Point to where your knee feels the worst.",
      "answer_type": "choice",
      "save_to": "knee_region",
      "source": "../v1/knee_regions.json",
      "next": [
        {
          "condition": { "type": "in", "key": "knee_region", "any_of": ["patella", "patellar_tendon"] },
          "next_node_id": "test_decline_squat"
        },
        {
          "condition": { "type": "in", "key": "knee_region", "any_of": ["posteromedial_tibial_plateau", "posterolateral_tibial_plateau"] },
          "next_node_id": "test_hamstring_bridge"
        },
        {
          "condition": { "type": "always" },
          "next_node_id": "q_symptom_duration"
        }
      ]
    },
    "test_decline_squat": {
      "id": "test_decline_squat",
      "type": "movement_test",
      "title": "Heel-elevated squat test",
      "instructions": "Place your heels on a small book or rolled towel and perform 3 slow squats. Report if the front of the knee feels better, same, or worse.",
      "video_id": "vid_decline_squat_v2",
      "metric_key": "decline_squat_response",
      "metric_type": "pain_change",
      "next": [
        {
          "condition": { "type": "equals", "key": "decline_squat_response", "value": "better" },
          "next_node_id": "dx_patellar_tendon"
        },
        {
          "condition": { "type": "equals", "key": "decline_squat_response", "value": "worse" },
          "next_node_id": "dx_patellofemoral"
        },
        { "condition": { "type": "always" }, "next_node_id": "q_symptom_duration" }
      ]
    },
    "test_hamstring_bridge": {
      "id": "test_hamstring_bridge",
      "type": "movement_test",
      "title": "Single-Leg Bridge Test",
      "instructions": "Lift into a bridge on one leg. Stop if pain jumps above 5/10 and report how it felt.",
      "metric_key": "hamstring_bridge_response",
      "metric_type": "pain_presence",
      "next": [
        {
          "condition": { "type": "equals", "key": "hamstring_bridge_response", "value": "painful" },
          "next_node_id": "dx_posterior_chain"
        },
        { "condition": { "type": "always" }, "next_node_id": "q_symptom_duration" }
      ]
    },
    "q_symptom_duration": {
      "id": "q_symptom_duration",
      "type": "question",
      "prompt": "How long has this knee pain been around?",
      "answer_type": "choice",
      "save_to": "symptom_duration",
      "options": [
        { "value": "acute_0_6w", "label": "0-6 weeks" },
        { "value": "subacute_6_12w", "label": "6-12 weeks" },
        { "value": "chronic_12w_plus", "label": "12+ weeks" }
      ],
      "next": [
        { "condition": { "type": "equals", "key": "symptom_duration", "value": "chronic_12w_plus" }, "next_node_id": "dx_chronic_overload" },
        { "condition": { "type": "always" }, "next_node_id": "dx_general_overload" }
      ]
    },
    "dx_patellofemoral": {
      "id": "dx_patellofemoral",
      "type": "assessment",
      "summary": "Likely patellofemoral overload",
      "explanation": "Elevated pain with decline squats suggests the kneecap joint is sensitive. Load shifts and gradual exposure usually help.",
      "region_id": "patella",
      "recommendations": [
        {
          "id": "mod_upright_squat",
          "title": "Try an upright squat with a hold",
          "type": "movement_mod",
          "description": "Keep the torso tall and squat only as deep as pain allows, pausing for a 5-second hold at the easiest depth."
        }
      ]
    },
    "dx_patellar_tendon": {
      "id": "dx_patellar_tendon",
      "type": "assessment",
      "summary": "Patellar tendon is tolerating heel lift",
      "explanation": "Feeling better with heels elevated points toward patellar tendon overload that likes reduced compression.",
      "region_id": "patellar_tendon",
      "recommendations": [
        {
          "id": "ex_decline_iso",
          "title": "Decline isometric hold",
          "type": "exercise",
          "description": "Hold a shallow decline squat for 30 seconds, 4-5 reps, keeping pain \u2264 3/10."
        }
      ]
    },
    "dx_posterior_chain": {
      "id": "dx_posterior_chain",
      "type": "assessment",
      "summary": "Posterior knee sensitivity",
      "explanation": "Pain with a single-leg bridge suggests the posterior capsule or hamstring insertion is sensitive right now.",
      "region_id": "posterolateral_tibial_plateau",
      "recommendations": [
        {
          "id": "mod_bridge_support",
          "title": "Bridge with hands-supported start",
          "type": "exercise",
          "description": "Start the bridge with both legs, then unweight one leg at the top for 3-5 seconds to ease the load."
        }
      ]
    },
    "dx_chronic_overload": {
      "id": "dx_chronic_overload",
      "type": "assessment",
      "summary": "Long-running knee overload",
      "explanation": "Symptoms beyond 12 weeks point to a slower adaptation curve. Consistency and low pain targets matter most.",
      "region_id": "suprapatellar_pouch",
      "recommendations": [
        {
          "id": "edu_consistency",
          "title": "Build a small daily habit",
          "type": "education",
          "description": "Do a 10-minute routine most days instead of sporadic long sessions."
        }
      ]
    },
    "dx_general_overload": {
      "id": "dx_general_overload",
      "type": "assessment",
      "summary": "General knee sensitivity",
      "explanation": "No single structure dominates. We'll calm things down briefly and reload with controlled steps.",
      "region_id": "anterolateral_tibial_plateau",
      "recommendations": [
        {
          "id": "mod_walk_bike",
          "title": "Stick to walk/bike intervals",
          "type": "movement_mod",
          "description": "Alternate 2 minutes easy walk with 1 minute relaxed cycling for 10-15 minutes to keep blood flow without flare-ups."
        }
      ]
    }
  }
}
